rowid,id,title,company,url
7036,7036,Việc làm Công nghệ Thông tin,CÔNG TY CỔ PHẦN THƯƠNG MẠI VÀ DỊCH VỤ GREEN FUTURE,https://www.topcv.vn/tim-viec-lam-cong-nghe-thong-tin-cr257
7039,7039,Fullstack Developer,TỔNG CÔNG TY CÔNG NGHIỆP CÔNG NGHỆ CAO VIETTEL,https://www.topcv.vn/tim-viec-lam-fullstack-developer-cr257cb258cl275
7046,7046,Việc làm Nhân sự/Hành chính/Pháp chế,CÔNG TY TNHH MỘT THÀNH VIÊN THƯƠNG MẠI VÀ DỊCH VỤ ĐẠI Á,https://www.topcv.vn/tim-viec-lam-nhan-su-hanh-chinh-phap-che-cr177
7047,7047,Việc làm Tài chính/Ngân hàng/Bảo hiểm,Ngân Hàng TMCP Việt Nam Thịnh Vượng (VPBank),https://www.topcv.vn/tim-viec-lam-tai-chinh-ngan-hang-bao-hiem-cr206
7048,7048,Việc làm Bất động sản,CÔNG TY QUẢN LÝ TÀI SẢN VIETTEL - CHI NHÁNH TẬP ĐOÀN CÔNG NGHIỆP VIỄN THÔNG QUÂN ĐỘI,https://www.topcv.vn/tim-viec-lam-bat-dong-san-cr333
7050,7050,Việc làm Kế toán/Kiểm toán/Thuế,CÔNG TY QUẢN LÝ TÀI SẢN VIETTEL - CHI NHÁNH TẬP ĐOÀN CÔNG NGHIỆP VIỄN THÔNG QUÂN ĐỘI,https://www.topcv.vn/tim-viec-lam-ke-toan-kiem-toan-thue-cr392
7056,7056,Việc làm Logistics/Thu mua/Kho/Vận tải,CÔNG TY TNHH MUYUAN VIỆT NAM,https://www.topcv.vn/tim-viec-lam-logistics-thu-mua-kho-van-tai-cr711
7057,7057,Việc làm Tư vấn chuyên môn,CÔNG TY TNHH QUẢNG CÁO HYPER MEDIA,https://www.topcv.vn/tim-viec-lam-tu-van-chuyen-mon-cr750
7066,7066,Việc làm Tài xế,,https://www.topcv.vn/tim-viec-lam-tai-xe-cr1042cb1049
7068,7068,Linkedin,,https://www.linkedin.com/oauth/v2/authorization
